imdb_name,Genres,Tags,Episodes,start airing,end airing,Aired On,Original Network,Duration,score,scored by,Ranked,Popularity,Content Rating,Watchers,actors,platforms,imdb_rating,imdb_user_count,imdb_description
Doctor Stranger,"['thriller', 'romance', 'drama', 'medical']","['nice male lead', 'scheme', 'hidden identity', 'kidnapping', 'second chance', 'north korean', 'unrequited love', 'father-son relationship', 'character development', 'trauma ']",20,5-May-14,8-Jul-14,"['monday', 'tuesday']",['SBS'],60,7.9,29103,1970,76,15+ - Teens 15 or older,"63,009","['Lee Jong Suk', 'Jin Se Yeon', 'Kang So Ra', 'Park Hae Jin', 'Chun Ho Jin', 'Lee Jae Won']","['SBS World', 'Viki', 'WeTV', 'Netflix', 'Apple TV']",7.5,"2,761","As a child, Park Hoon (Lee Jong-suk) and his father were kidnapped by North Korea. In North Korea, Park Hoon was trained to become a doctor by his father who was already a famous doctor. Park Hoon became a genius thoracic surgeon. He deeply fell in love with Jae Hee (Jin Se-yeon) in his high school. Park Hoon's father then died and he tried to flee to South Korea with Jae Hee, but lost in contact with her and at the end, he fled to South Korea alone, while looking for Jae Hee. In South Korea, Park Hoon begins to work as doctor in a top hospital Myungwoo University Hospital. Meanwhile, he found a girl that looks exactly like Jae Hee, Doctor Han Seung Hee, who claimed to not know Park Hoon. Then it appears that she's involved in a secret mission with a man who hates Park Hoon back in North Korea.

â€”D. Biswas"
He is Psychometric,"['thriller', 'mystery', 'romance', 'supernatural']","['psychometry', 'special power', 'tragic past', 'nice male lead', 'smart female lead', 'bromance', 'strong female lead', 'slow romance', 'sassy female lead', 'death ']",16,11-Mar-19,30-Apr-19,"['monday', 'tuesday']",['tvN'],64,8.4,27995,527,66,15+ - Teens 15 or older,"65,900","['Park Jin Young', 'Shin Ye Eun', 'Kim Kwon', 'Kim Da Som', 'Noh Jong Hyun', 'Go Yoon Jung']","['Viki', 'WeTV', 'K-DRAMA', 'Apple TV']",7.7,"1,640","A boy who is able to read the secrets of those whose skin comes into contact with him, and a girl who does everything she can to hide her pain. In the drama, the boy and girl will meet and try to fix, heal, grow, and love from the small and big occurrences that happen in their lives."
"From Now On, Showtime!","['mystery', 'comedy', 'romance', 'fantasy']","['supernatural', 'ghost', 'magician male lead', 'police officer female lead', 'ghost-seeing male lead', 'slow burn romance', 'secret', 'special power', 'investigation', 'ghost supporting character ']",16,23-Apr-22,12-Jun-22,"['saturday', 'sunday']","['MBC', 'ViuTV']",73,8.4,5043,423,726,15+ - Teens 15 or older,"14,127","['Park Hae Jin', 'Jin Ki Joo', 'Jung Joon Ho', 'Go Gyu Pil', 'Jung Suk Yong', 'Park Seo Yeon']",['Viki'],7.4,314,"Cha Cha Woong is a popular TV magician with a taste for the spectacular. His path crosses with that of Go Seul Hae, a young and passionate police officer. She convinces him to join the police force in its efforts to catch criminals."
Father Is Strange,"['comedy', 'romance', 'drama', 'family']","['family secret', 'eccentric female lead', 'fake incest', 'multiple couples', 'strong female lead', 'father-daughter relationship', 'mother-daughter relationship', 'mother-son relationship', 'father-son relationship', 'evil mother-in-law ']",52,4-Mar-17,27-Aug-17,"['saturday', 'sunday']",['KBS2'],66,8.6,10150,226,340,15+ - Teens 15 or older,"25,176","['Kim Yeong Cheol', 'Kim Hae Sook', 'Ryu Soo Young', 'Lee Yoo Ri', 'Lee Joon', 'Jung So Min']","['Apple TV', 'Viki']",8.2,547,"Ahn Joong-Hee (Lee Joon) is an actor who used to be a member of an idol group. One day, he appears in front of a family who consists Byun Han-Soo and Na Young-Sil and their 4 children including Hye-Young and Mi-Young (Jung So-Min). Joong-Hee begins to live wth them"
Train,"['thriller', 'mystery', 'sci-fi']","['parallel dimension', 'suspense', 'murder', 'death', 'tough female lead', 'slight romance', 'strong male lead', 'crossworlds traveler', 'first love', 'orphan female lead ']",12,11-Jul-20,16-Aug-20,"['saturday', 'sunday']",['OCN'],60,8.4,6478,437,597,15+ - Teens 15 or older,"16,812","['Yoon Shi Yoon', 'Kyung Soo Jin', 'Shin So Yool', 'Lee Hang Na', 'Nam Moon Chul', 'Jo Wan Ki']",['Viki'],s 8,836,A sci-fi melodrama about a man who tries to protect his beloved from a serial killer in a parallel universe.
The Cursed,"['thriller', 'mystery', 'horror', 'supernatural']","['strong female lead', 'shamanism', 'curse', 'gore', 'extreme violence', 'school bullying', 'investigation', 'occult', 'smart female lead', 'spirit ']",12,10-Feb-20,17-Mar-20,"['monday', 'tuesday']",['tvN'],63,7.9,1927,2105,1693,15+ - Teens 15 or older,"5,815","['Uhm Ji Won', 'Jung Ji So', 'Sung Dong Il', 'Jo Min Soo', 'Jung Moon Sung', 'Kim Min Jae']","['WeTV', 'Netflix']",7.1,484,"""The Cursed"" is about a teenage girl who has the ability to bring death by using names, photos, and belongings, and a just social issues reporter, fighting against the massive evil hidden behind an IT conglomerate."
You Are Beautiful,"['music', 'comedy', 'romance', 'drama']","['cross-dressing', 'love triangle', 'gender bender', 'identity swap', 'singing', 'twin exchange', 'bromance', 'cold man/warm woman', 'naive female lead', 'band ']",16,7-Oct-09,26-Nov-09,"['wednesday', 'thursday']",['SBS'],65,8,49394,1424,37,15+ - Teens 15 or older,"80,497","['Jang Geun Suk', 'Park Shin Hye', 'Jung Yong Hwa', 'Lee Hong Ki', 'Uee', 'Kim In Kwon']","['Viki', 'Netflix']",7.7,"4,728","Go Mi-Nyu, a girl about to become a nun, is asked to cover for her indisposed twin brother, Mi-Nam, who's on the verge of becoming a k-idol. To do so, she disguises herself as a boy and joins A.N.Jell, a really popular boy band."
To the Beautiful You,"['comedy', 'romance', 'drama', 'sports']","['high school', 'cross-dressing', 'adapted from a manga', 'high jump', ""roommates' relationship"", 'athlete male lead', 'dormitory', 'popular male lead', 'cold male lead', 'gender bender ']",16,15-Aug-12,4-Oct-12,"['wednesday', 'thursday']",['SBS'],64,7.6,31376,3663,87,15+ - Teens 15 or older,"57,098","['Sulli', 'Choi Min Ho', 'Lee Hyun Woo', 'Kim Ji Won', 'Seo Joon Young', 'Kang Ha Neul']",['Viki'],7.2,"1,938",A high school girl who's inspired by a gold-medal High Jumper devises a scheme to motivate him by attending his school.
Nobody Knows,"['thriller', 'mystery', 'drama', 'melodrama']","['strong female lead', 'smart female lead', 'murder', 'death', 'guilt', 'unusual friendship', 'calm female lead', 'trauma', 'friendship', 'self-harm ']",16,2-Mar-20,21-Apr-20,"['monday', 'tuesday']",['SBS'],70,8.5,3784,278,687,15+ - Teens 15 or older,"14,686","['Kim Seo Hyung', 'Ryu Deok Hwan', 'Park Hoon', 'Ahn Ji Ho', 'Min Jin Woong', 'Kang Ye Won']",['Viki'],8.1,298,"Still haunted by the death of her friend who was murdered 19 years ago by the infamous Stigmata serial killer, detective Cha Young Jin is determined to catch the culprit."
Heartless City,"['action', 'thriller', 'romance', 'crime']","['badass male lead', 'gang', 'bromance', 'strong female lead', 'strong male lead', 'smart male lead', 'sismance', 'steamy kiss', 'orphan male lead', 'detective male lead ']",20,27-May-13,30-Jul-13,"['monday', 'tuesday']",['jTBC'],60,8.6,9169,242,386,15+ - Teens 15 or older,"22,720","['Jung Kyung Ho', 'Nam Gyu Ri', 'Lee Jae Yoon', 'Son Chang Min', 'Kim Yoo Mi', 'Choi Moo Sung']",['Viki'],8.1,481,Revolves around several different characters in a world of drugs and murder..
Undercover,"['action', 'thriller', 'mystery', 'crime']","['corruption', 'strong female lead', 'double identity', 'political', 'loving husband', 'strong male lead', 'smart female lead', 'family relationship', 'married couple', 'smart male lead ']",16,23-Apr-21,12-Jun-21,"['friday', 'saturday']",['jTBC'],75,7.9,1150,1683,1761,15+ - Teens 15 or older,"5,502","['Ji Jin Hee', 'Kim Hyun Joo', 'Yeon Woo Jin', 'Han Sun Hwa', 'Yoo Sun Ho', 'Lee Jae In']",[],7.7,187,"A female civil-rights lawyer begins to doubt her husband, whom she has been married for 20 years."
Peurodyusa,"['comedy', 'romance', 'drama']","['entertainment industry', 'love triangle', 'boss-employee relationship', 'unrequited love', 'older woman/younger man', 'cohabitation', 'secondary couple', 'producer female lead', 'producer male lead', 'age gap [drama life] ']",12,15-May-15,20-Jun-15,"['friday', 'saturday']",['KBS2'],85,7.6,13807,3620,221,15+ - Teens 15 or older,"34,128","['Cha Tae Hyun', 'Gong Hyo Jin', 'Kim Soo Hyun', 'IU', 'Kim Jong Kook', 'Na Young Hee']","['Viki', 'WeTV']",7.3,"1,400","A group of young television producers--Ra Joon Mo, Baek Seung Chan, Tak Ye Jin--and K-pop star Cindy work tirelessly around the clock within the entertainment division of a major broadcasting network. Amidst their dynamic, challenging workloads, serious drama reaches new heights in this backstage glimpse of the people who make television magic happen. Baek Sung Chan is a fresh new producer. He was a law graduate of an Ivy-League school who now works in the variety department of KBS. He made the career switch after following in the footsteps of his first love, which didn't work out for him. Although he is intelligent, he is also clumsy. As the new intern, he has a lot to learn if he wants to succeed in the Korean entertainment industry. Tak Ye Jin is a hot-shot producer who gets things done her way. She has 10 years of experience in the industry. She is smart and ambitious, but can be caustic in her criticism and doesn't sugarcoat her opinions. She is the director of the popular show ""Music Bank"". If Baek Sung Chan wants to succeed, he'll need outperform her expectations...or avoid Tak Ye Jin completely, neither of which will be easy tasks. Ra Joon Mo is a seasoned producer and director who has also worked in the industry for 10 years. Yet despite his immense experience and his contributions to numerous shows, he has yet to develop a single hit show that he can be proud to call his own. Cindy is a top star and temperamental singer. She ""debuted"" as a child of 13; now at 23 she can actually be considered a veteran. She's known as an ice princess because she never lets herself feel deep affection for anyone. She experienced a lot of betrayal in the past that causes her to keep everyone at a safe distance. The story will leave various deep messages about friendship, family, fame, support, bullying, and betrayal in the broadcast industry."
Kill It,"['action', 'thriller', 'mystery', 'drama']","['murder', 'hidden identity', 'calm male lead', 'badass male lead', 'strong male lead', 'strong female lead', 'hidden past', 'suspense', 'skilled killer', 'veterinarian ']",12,23-Mar-19,28-Apr-19,"['saturday', 'sunday']",['OCN'],60,8.2,11152,889,260,15+ - Teens 15 or older,"30,676","['Nana', 'Jang Ki Yong', 'Roh Jeong Eui', 'Lee Jae Won', 'Jung Hae Kyun', 'Ji  Il Joo']","['Viki', 'WeTV']",7.7,865,"Will a killer-turned-veterinarian and a detective find a common ground? Kim Soo Hyun is a veterinarian who was once a professional killer. Nobody in the public knows anything about him as a killer, including his age, name and race. Deep inside, he constantly looks for love, but struggles to develop and maintain any pure relationships around him. Do Hyun Jin is a brilliant detective working in Seoul, who graduated from police academy as the most excelled. Although she looks cold and stern on the outside, she is in fact a very sympathetic individual. Hyun Jin trusts her instincts and isn't afraid to rely on the things around her to make a decision to the best of her abilities. She has suffered trauma but still keeps pushing forward."
Mad Dog,"['action', 'thriller', 'mystery']","['revenge', 'tragic past', 'enemy mine', 'vigilante', 'corruption', 'insurance', 'strong female lead', 'teamwork', 'fraud', 'investigation ']",16,11-Oct-17,30-Nov-17,"['wednesday', 'thursday']",['KBS2'],60,8.4,10517,444,319,15+ - Teens 15 or older,"26,414","['Yoo Ji Tae', 'Woo Do Hwan', 'Ryu Hwa Young', 'Jo Jae Yoon', 'Kim Hye Sung', 'Hong Soo Hyun']","['Viki', 'Apple TV']",7.7,712,"Choi Kang-woo, a former police and leader of Taeyang Insurance's investigators team, decides to create his own investigation team, after an airplane crash that took the life of his wife and son. He then meet Kim Min-joon, a genius former swindler whose brother was also a victim of the crash, thus begin their rivalry and cooperation.

â€”Rahma"
Man to Man,"['action', 'thriller', 'comedy', 'romance']","['hidden identity', 'spy', 'bromance', 'strong male lead', 'eccentric female lead', 'eccentric male lead', 'undercover agent', 'car accident', 'smart male lead', ""roommates' relationship ""]",16,21-Apr-17,10-Jun-17,"['friday', 'saturday']",['jTBC'],65,7.8,11132,2285,314,15+ - Teens 15 or older,"26,572","['Park Hae Jin', 'Kim Min Jung', 'Park Sung Woong', 'Yeon Jung Hoon', 'Chae Jung An', 'Jung Man Shik']",['Netflix'],7.4,"1,330",A secret agent works under cover as a bodyguard and is forced to deal with both national security missions as well as a temperamental superstar.
High Kick!,"['comedy', 'romance', 'drama', 'sitcom']","['multiple mains', 'hidden identity', 'older woman/younger man', 'death', 'divorce', 'sismance', 'murder', 'multiple couples', 'unrequited love', 'bromance ']",167,6-Nov-06,13-Jul-07,"['monday', 'tuesday', 'wednesday', 'thursday', 'friday']",['MBC'],30,8.1,1202,1227,2418,13+ - Teens 13 or older,"3,832","['Jung Il Woo', 'Kim Hye Sung', 'Choi Min Yong', 'Lee Soon Jae', 'Na Moon Hee', 'Park Hae Mi']",[],8.4,398,"Lee Yoon-ho (Jung Il-Woo), a motorcycle mania who engages in many fights at school and is known for his high kick, and Lee Min-ho (Kim Hye-Seong) who enjoys spending time on scale models and web blogs, are brothers born a year apart but attending the same class at school. These two portray completely opposite Korean teenage characters in a comical way. And of course, there's the rest of the family. Their father Jun-ha Lee (Jeong Jun-Ha), a full-time stock investor since being laid-off from work, nevertheless optimistic and reckless; their mother Park Hae Mi (Park Hae-Mi), an oriental medicine doctor and always overly confident; their grandfather Lee Soon Jae (Lee Sun-Jae), who loves money more than anything in the world; their grandmother Nah Mun Hee (Na Moon-Hee), who is always defeated by her daughter-in-law in ongoing status quarrels, are some of them. Their uncle Lee Min-yong (Kim Hye-Seong) is a 27-year-old single dad. After going through a premature marriage and early divorce, he enjoys his life back in the dating scene with his half-single and half-married status, while continuing to encounter emotionally-involved moments with his ex-wife Shin Ji at times. Smooth High Kick. is a situation comedy, which portrays the everyday lives of the main characters colliding with each other in a comical way. However, at a certain point, the surprising mysteries of their seemingly-normal surrounding characters begin to unravel one by one."
Color Rush,"['mystery', 'romance', 'drama', 'supernatural']","['obsessive male lead', 'soulmates', 'lgbtq+', 'obsession', 'high school', 'student', 'web series', 'aunt-nephew relationship', 'psychological', 'missing person ']",8,30-Dec-20,21-Jan-21,"['wednesday', 'thursday']","['LINE TV', 'Viki', 'ViuTV']",15,7.7,22809,2774,202,15+ - Teens 15 or older,"36,161","['Yoo Jun', 'Hur Hyun Jun', 'Yeon Min Ji', 'Baek Seo Hoo', 'Min Hyo Gi']","['Apple TV', 'Viki']",s 7,999,"Living with neurological blindness that limits his ability to see color, Yeon Woo has grown up in a world that looks very different from the one most people are accustomed to seeing. Only able to decipher varying tones of gray, Yeon Woo knows the world is full of colors but he has never seen them for himself. At least not until the day Yoo Han comes crashing into his world. As if brought together by fate, Yeon Woo's life is forever changed the day he meets Yoo Han. Falling for the boy's many charms, Yeon Woo is overwhelmed by the unexpected rush of emotions he feels every time Yoo Han is near. What's even more surprising is the sudden rush of color that washes over the world whenever Yoo Han walks into the room. Could this be a sign that Yoo Han is his destiny? While Yeon Woo ponders his fate, his aunt Yi Rang searches desperately for the sister who went missing years ago. Joining his aunt on her quest, Yeon Woo recruits Yoo Han's help and together they search for his mother. As they dig deeper into the mystery surrounding her disappearance, an unexpected story begins to unfold. Will these fated boys be able to solve the mystery of a missing mother while simultaneously unraveling the mysteries of their own hearts?"
VIP,"['mystery', 'business', 'romance', 'melodrama']","['infidelity', 'strong female lead', 'boss-employee relationship', 'multiple mains', 'office worker', 'sexual harassment', 'extramarital affair', 'conglomerate', 'mother-daughter relationship', 'father-daughter relationship ']",32,28-Oct-19,24-Dec-19,"['monday', 'tuesday']",['SBS'],30,8,3768,1439,1026,15+ - Teens 15 or older,"9,949","['Jang Na Ra', 'Lee Sang Yoon', 'Lee Chung Ah', 'Kwak Sun Young', 'Pyo Ye Jin', 'Shin Jae Ha']","['Viki', 'Netflix', 'SBS World']",7.6,353,A woman whose seemingly perfect life is turned around when an anonymous messenger tells her her husband is having an affair.
Seven Day Queen,"['historical', 'romance', 'melodrama', 'political']","['joseon dynasty', 'sibling rivalry', 'lying', 'revenge', 'first love', 'strong female lead', 'love triangle', 'royalty', 'jealousy', 'drama ']",20,31-May-17,3-Aug-17,"['wednesday', 'thursday']",['KBS2'],60,8.3,6406,765,536,15+ - Teens 15 or older,"18,183","['Park Min Young', 'Yeon Woo Jin', 'Lee Dong Gun', 'Jang Hyun Sung', 'Kang Shin Il', 'Go Bo Gyeol']","['Viki', 'Apple TV']",7.7,534,"Kyung is the daughter of a powerful politician during the Joseon Dynasty. She falls in love with Crown Prince Lee Yuk, who lives under the tyranny of his half-brother, King Yeon San Gun. When Lee Yuk rises to the throne and becomes King Jung Jong, Chae Kyung becomes Queen Dan Kyung, who becomes caught in the cross-fires of different political factions as well as the jealousies between the brothers When Dan Kyung's own father stages a coup against the king, Queen Dan Kyung is dethroned only after seven days and expelled from the palace. What will happen to the love between the king and queen when they can no longer be together?

â€”Zahra Salahi"
Birth of a Beauty,"['comedy', 'romance', 'drama', 'melodrama']","['makeover', 'plastic surgery', 'rich male lead', 'transformation', 'revenge', 'cohabitation', 'food', 'hidden identity', 'misunderstanding', 'amnesia ']",21,1-Nov-14,11-Jan-15,"['saturday', 'sunday']",['SBS'],60,7.5,13831,3940,277,15+ - Teens 15 or older,"29,316","['Joo Sang Wook', 'Han Ye Seul', 'Jung Gyu Woon', 'Wang Ji Hye', 'Han Sang Jin', 'Ha Jae Sook']","['Viki', 'Netflix', 'SBS World']",s 7,945,"Overweight, kind-hearted Sa Geum-ran (Ha Jae-sook) married into a well-to-do family, but her husband Lee Kang-joon (Jung Gyu-woon) has spent the past seven years in the United States for his business, and she lives with his mother and sisters who treat her badly. Geum-ran learns that Kang-joon has been having an affair with sophisticated broadcast announcer Gyo Chae-yeon (Wang Ji-hye), and he asks for a divorce. When she sees her in-laws welcoming Chae-yeon with open arms, the distraught Geum-ran threatens her husband, who follows her and causes her to drive her car off a cliff. Everyone assumes that Geum-ran committed suicide and attends her funeral, not knowing that she's still alive. To get revenge against those who've wronged and betrayed her, Geum-ran begs Han Tae-hee (Joo Sang-wook), whom she thought was the plastic surgeon of extreme-makeover television show Change, to transform her, and he reluctantly agrees because of his own ulterior motives. After weight loss and surgery, Geum-ran emerges from the full-body makeover as a stunningly beautiful woman, and she begins calling herself the new name Sara (Han Ye-seul), albeit retaining her coarse ajumma personality. With Tae-hee as her life coach, they scheme to ruin Kang-joon and Chae-yeon's upcoming wedding in three weeks. But as Sara interacts with Kang-joon in their staged run-ins, old feelings resurface, and she decides that instead of destroying him, she wants her husband back. They adjust their plan accordingly, though Tae-hee soon finds himself falling for Sara."
Imitation,"['music', 'comedy', 'romance', 'drama']","['entertainment industry', 'youth', 'rivalry', 'k-pop', 'friendship', 'unfortunate female lead', 'hardworking female lead', 'love square', 'hardworking male lead', 'sismance ']",12,7-May-21,23-Jul-21,['friday'],"['KBS2', 'Viki']",70,8.1,10623,1348,332,15+ - Teens 15 or older,"25,955","['Jung Ji So', 'Lee Jun Young', 'Park Ji Yeon', 'Jeong Yun Ho', 'Danny Ahn', 'Chani']","['Viki', 'Netflix']",7.5,688,"Based on the webtoon of the same name, it tells the story of the lives of idols in the entertainment industry, centered around the secret romance between a member of a rookie girl group and a member of the top boy group in the industry."
Welcome to Wedding Hell,"['romance', 'life', 'drama']","['wedding', 'marriage', 'family', 'bright female lead', 'friendship ']",12,23-May-22,15-Jun-22,"['monday', 'tuesday', 'wednesday']","['Daum Kakao TV', 'Netflix']",38,7.3,1163,5130,2261,15+ - Teens 15 or older,"4,179","['Lee Yun Hee', 'Lee Jin Wook', 'Hwang Seung Eon', 'Song Jin Woo', 'Kim Joo Yeon', 'Kim  Mi Kyung']",['Netflix'],s 6,137,"A marriage proposal is supposed to be a happy ending. But for one couple, it becomes the beginning of an uphill struggle over wedding preparations."
School 2021,"['romance', 'youth', 'drama', 'melodrama']","['high school', 'student', 'friendship', 'mature female lead', 'coming of age', 'innocent male lead', 'hardworking male lead', 'first love', 'multiple mains', 'transfer student ']",16,24-Nov-21,13-Jan-22,"['wednesday', 'thursday']","['KBS2', 'Viki']",63,8,4496,1611,634,15+ - Teens 15 or older,"15,906","['Kim Yo Han', 'Choo Young Woo', 'Jo Yi Hyun', 'Hwang Bo Reum Byeol', 'Kim Kang Min', 'Seo Hee Seon']",['Viki'],7.4,265,"The story of students of a specialized high school seeking their ambitions, rather than going off to college. It will delve into how these students learn about love, friendship, true passions, and growing up in an intense environment."
Once Again,"['comedy', 'romance', 'life', 'drama']","['divorce', 'multiple couples', 'multiple mains', 'marriage', 'bickering couple', 'love/hate relationship', 'secret relationship', 'muteness', 'mother-daughter relationship', 'nice male lead ']",100,28-Mar-20,13-Sep-20,"['saturday', 'sunday']",['KBS2'],35,8.6,4056,231,955,15+ - Teens 15 or older,"10,662","['Chun Ho Jin', 'Cha Hwa Yun', 'Lee Jung Eun', 'Oh Dae Hwan', 'Lee Min Jung', 'Lee Sang Yeob']","['Viki', 'Apple TV']",8.3,323,"""Once Again"" is a story about love and family based on the Song Family, who never have a peaceful day."
Dear X Who Doesn't Love Me,"['romance', 'drama']","['miniseries', 'trauma', 'web series', 'student ']",10,14-Jul-22,28-Jul-22,['thursday'],"['iQiyi', 'Viki']",30,7.1,587,5498,3032,15+ - Teens 15 or older,"2,885","['Han Ji Hyo', 'Kim Do Young', 'Kwon Ah Reum', 'a.mond', 'Son Hyun Woo', 'Kim Ji Hoon']",['Viki'],6.8,21,"'To X who doesn't love me' is a story of young people in their 20s who are struggling with their dreams and love, heralding the birth of a reality-sympathetic drama. 'To X Who Doesn't Love Me' is a ""expiry date"" romance drama that tells the story of Seo Hee Su, a college student and aspiring lyricist with zero self-esteem and zero self-love, who discovers a mysterious lyric note that makes anyone fall in love with her for a month and gets intertwined with Jung Si Ho.

â€”mydramalist"
The Light in Your Eyes,"['romance', 'life', 'drama', 'melodrama']","['life lesson', 'family relationship', 'time loop', 'father-daughter relationship', 'time manipulation', 'mother-daughter relationship', 'poor male lead', 'double identity', 'poor female lead', 'first love ']",12,11-Feb-19,19-Mar-19,"['monday', 'tuesday']","['jTBC', 'Viki']",60,8.2,6993,956,430,15+ - Teens 15 or older,"21,330","['Han Ji Min', 'Kim Hye Ja', 'Nam Joo Hyuk', 'Son Ho Jun', 'Ahn Nae Sang', 'Lee Jung Eun']","['Disney+ Hotstar', 'Hulu', 'Viki']",7.9,736,This story is about a woman who loses all her time before she can use it up and a man who gives up all of his radiant moments and lives a lethargic life.
Watcher,"['thriller', 'mystery', 'drama', 'political']","['smart male lead', 'smart female lead', 'tragic past', 'corruption', 'psychological', 'trauma', 'nice male lead', 'badass male lead', 'character development', 'detective fiction ']",16,6-Jul-19,25-Aug-19,"['saturday', 'sunday']",['OCN'],65,8.3,4108,656,779,15+ - Teens 15 or older,"13,350","['Seo Kang Joon', 'Han Seok Kyu', 'Kim Hyun Joo', 'Park Joo Hee', 'Heo Sung Tae', 'Joo Jin Mo']","['Disney+ Hotstar', 'Viki']",7.8,414,"The lives of Do Chi Gwang, Kim Young Koon and Han Tae Joo were destroyed by a tragic affair. They became members of an internal affairs investigation team for the police and they try to dig up the truth on who is behind the tragic affair."
Live,"['comedy', 'romance', 'life', 'drama']","['teamwork', 'violence', 'strong female lead', 'smart female lead', 'male chases female first', 'rape', 'nice male lead', 'investigation', 'marriage', 'love triangle ']",18,10-Mar-18,6-May-18,"['saturday', 'sunday']","['Netflix', 'tvN']",75,8.7,7116,160,502,15+ - Teens 15 or older,"18,995","['Lee Kwang Soo', 'Jung Yu Mi', 'Bae Sung Woo', 'Bae Jong Ok', 'Sung Dong Il', 'Jang Hyun Sung']","['K-DRAMA', 'Netflix']",8.3,"1,295","The drama revolves around the incidents that occur among the police force and the joy, sorrow, and pain that police officers experience as they try to protect justice."
