imdb_name,Genres,Tags,Episodes,start airing,end airing,Aired On,Original Network,Duration,score,scored by,Ranked,Popularity,Content Rating,Watchers,actors,platforms,imdb_rating,imdb_user_count,imdb_description
Man Who Sets the Table,"['food', 'romance', 'drama', 'family']","[""unhealthy mains' relationship"", 'conglomerate', 'greed', ""girls' generation (snsd)"", 'soap opera', 'emotional abuse', 'deception', 'heir', 'divorce', 'inheritance theft ']",50,2-Sep-17,18-Mar-18,"['saturday', 'sunday']",['MBC'],75,7.2,468,5161,3817,15+ - Teens 15 or older,"2,078","['Choi Soo Young', 'Ohn Joo Wan', 'Park Jin Woo', 'Seo Hyo Rim', 'Shim Hyung Tak', 'Lee Il Hwa']",['Viki'],6.4,29,"After devoting 35 years of his life to his company, he was now retired. People envied him for the success he achieved in his career. Now he was looking forward to enjoying his retirement years with his wife into old age. But his wife suddenly demands a marriage separation. And his daughter whom he had thought he raised well was now rebelling against him. He worked so hard all his life but why was everything going down the drain at this point of his life? The collapse of the family is a reality that one middle-aged man is trying to reverse.

â€”MBC America"
Item,"['action', 'thriller', 'mystery', 'supernatural']","['adapted from a webtoon', 'impulsive male lead', 'tragic past', 'mad dog', 'supernatural phenomena', 'priest', 'criminal profiler', 'corruption', 'precognition', 'revenge ']",32,11-Feb-19,2-Apr-19,"['monday', 'tuesday']",['MBC'],35,7.4,1858,4420,1448,15+ - Teens 15 or older,"6,965","['Joo Ji Hoon', 'Jin Se Yeon', 'Kim Kang Woo', 'Kim Yoo Ri', 'Park Won Sang', 'Lee Dae Yeon']","['Apple TV', 'Viki']",6.4,160,A mystery fantasy drama about a profiler and a prosecutor who uncover a conspiracy and secrets surrounding objects with special powers.
Times,"['thriller', 'mystery', 'fantasy', 'political']","['time warp', 'different timelines', 'time altering', 'sci-fi', 'father-daughter relationship', 'determined female lead', 'hardworking male lead', 'death', 'investigation', 'suspense ']",12,20-Feb-21,28-Mar-21,"['saturday', 'sunday']",['OCN'],60,7.7,1175,3072,2307,15+ - Teens 15 or older,"4,096","['Lee Seo Jin', 'Lee Joo Young', 'Kim Yeong Cheol', 'Moon Jung Hee', 'Kim In Kwon', 'Moon Ji In']","['Viki', 'WeTV']",7.5,104,"A ""time warping"" political mystery drama that tells the story of Seo Jeong In, who becomes connected to reporter Lee Jin Woo from five years in the past through a phone call."
Big Man,"['thriller', 'business', 'drama', 'melodrama']","['cold female lead', 'secondary couple', 'naive male lead', 'orphan male lead', 'power struggle', 'deception', 'betrayal', 'strong female lead', 'rags to riches', 'revenge ']",16,28-Apr-14,17-Jun-14,"['monday', 'tuesday']",['KBS2'],60,7.3,2026,5037,1748,Not Yet Rated,"5,557","['Kang Ji Hwan', 'Lee Da Hee', 'Choi Daniel', 'Jung So Min', 'Han Sang Jin', 'Uhm Hyo Sub']",['KBS World'],7.3,91,"Kim Ji-Hyeok (Kang Ji-Hwan) doesn't have parents and goes through a tough life. He then meets Dal-Sook who runs a small restaurant at a traditional market. Kim Ji-Hyeok follows her like his mother and settles down at the traditional market. He works hard to open up his own store within the traditional market. Suddenly, Kim Ji-Hyeok becomes a hidden son from a family that owns Korea's top company Hyunsung. He realizes though that there are impure intentions. Since that moment, Kim Ji-Hyeok takes revenge upon the people at the Hyunsung company. He becomes romantically involved with a woman named So Mi-Ra (Lee Da-Hee) who he meets at the most important time in his life."
Mrs. Cop,"['action', 'mystery']","['police department setting', 'detective male lead', 'detective female lead', 'single mother', 'attempted murder', 'crime against children', 'attempted sexual assault', 'death of a parent', 'slight romance', 'teamwork ']",18,3-Aug-15,29-Sep-15,"['monday', 'tuesday']",['SBS'],65,7.9,1612,1978,1911,Not Yet Rated,"5,036","['Kim Hee Ae', 'Kim Min Jong', 'Lee Da Hee', 'Son Ho Jun', 'Shin So Yool', 'Lee Gi Kwang']","['SBS World', 'Viki', 'SBS VOD', 'Apple TV']",8.1,102,"Crime drama about female detective squad chief, who also raises her daughter. The joys and sorrows of being a working mom in Korea are explored through the life of passionate middle-aged female cop."
Sandglass,"['action', 'historical', 'romance', 'political']","['gwangju uprising', '1980s', 'rich female lead', 'friendship', 'death of a parent', '1970s', 'gangster male lead', 'detective supporting character', 'prosecutor supporting character', 'prosecutor male lead ']",24,9-Jan-95,16-Feb-95,"['monday', 'tuesday', 'wednesday', 'thursday', 'friday']",['SBS'],51,8.1,215,61360,5191,Not Yet Rated,"1,301","['Go Hyun Jung', 'Park Sang Won', 'Choi Min Soo', 'Lee Jung Jae', 'Park Geun Hyung', 'Nam Sung Hoon']",[],8.7,43,"Tae Soo is the son of a prostitute who has to give up his studies; he joins a gang to support himself. Woo Suk is the son of the upright farmer who studies law while working part time. Hye Rin is the daughter of a crooked casino owner mob boss who gives up her lavish yet tumultuous life to pursue her studies at a University. She joins a student protest movement. It is the 1970's and South Korea is in a political upheaval. Students are abandoning their studies and joining protests and marches against the oppressive regime. Meanwhile Taesoo quickly rises up in the ranks of his crime family. His friend Woo Suk struggles to get through school while working part time jobs. One day, Woo Suk meets Hye Rin at an eatery populated by University students. Woo Suk falls in love with Hye Rin. Then Hye Rin meets Tae Soo and he falls for Hye Rin. Meanwhile Baek Jae Hee the former bodyguard of Hye Rin quietly and painfully follows her wherever she goes.

â€”Illustrious"
Argon,"['mystery', 'drama', 'political']","['boss-employee relationship', 'journalism', 'corruption', 'news anchor', 'workplace setting', 'mild sexual content', 'death of a wife', 'reporter male lead', 'reporter female lead', 'single father male lead ']",8,4-Sep-17,26-Sep-17,"['monday', 'tuesday']",['tvN'],70,8,1614,1471,2221,15+ - Teens 15 or older,"4,257","['Kim  Joo Hyuk', 'Chun Woo Hee', 'Park Won Sang', 'Shin Hyun Bin', 'Park Hee Bon', 'Shim Ji Ho']",['Netflix'],7.3,276,"ARGON shows the struggles behind the scenes in the competitive world or daily news. Work, play, love, hate, trust and betrayal are on the headlines every episode."
Hur Jun,['historical'],"[""emperor's physician"", 'doctor male lead', 'historical figure', 'historical fiction', 'joseon dynasty ']",64,22-Nov-99,27-Jun-00,"['monday', 'tuesday']",['MBC'],60,7.9,143,63091,9954,Not Yet Rated,425,"['Hwang Soo Jung', 'Jeon Kwang Ryul', 'Jeon Hye Soo', 'Jo  Hyun Sook', 'Lee Hyun Kyung', 'Cha Kwang Soo']",[],8.6,70,"The life, struggle and ascension of doctor Hur Jun, an exponential medical figure during his times."
Punch,"['thriller', 'drama', 'political']","['corruption', 'terminal illness', 'strong female lead', 'power struggle', 'morally ambiguous male lead', 'prosecutor female lead', 'prosecutor male lead', 'greed', 'married couple', 'father-daughter relationship ']",19,15-Dec-14,17-Feb-15,"['monday', 'tuesday']",['SBS'],62,8.1,1461,1211,1774,15+ - Teens 15 or older,"5,456","['Kim Rae Won', 'Kim Ah Joong', 'Jo Jae Hyun', 'Seo Ji Hye', 'Choi Myung Gil', 'Ohn Joo Wan']","['SBS World', 'Viki']",7.4,14,Yu Bin's brother dies in a boxing match. Yu Bin decides to become a female boxer. Yu Bin meets Han Sae and the two become a couple.
Standby,"['business', 'comedy', 'sitcom']",[''],113,9-Apr-12,5-Oct-12,"['monday', 'tuesday', 'wednesday', 'thursday', 'friday']",['MBC'],23,7.5,132,68653,6222,Not Yet Rated,987,"['Jung So Min', 'Kim Su Hyun', 'Im Si Wan', 'Lee Ki Woo', 'Ha Seok Jin', 'Ryu Jin']",[],9.2,58,"Standby is a workplace comedy that takes place at a fictional broadcast station, where our series lead Ryu Jin finds himself stuck in a career slump (can it be a slump if it never took off?) amid st dreams of anchoring the nightly news. Other characters include variety PDs, writers, and announcers who make up the broadcast station family. Jung plays a young woman named So-min who grew up in a remote mountain village. She finds herself working a number of odd jobs once she makes the big move to Seoul, determined to make her way in the world and work hard at a successful career. So-min (the character) is a little behind the fashions and tends to say weird things that puzzle people, but she's got a warm heart and a generous personality. Sadly, though, it's that trusting nature that also makes her a target for opportunists."
Mom,"['romance', 'drama', 'family', 'melodrama']","['married couple', 'cancer', 'nice male lead', 'marriage', 'pregnancy ']",54,15-Aug-15,14-Feb-16,"['saturday', 'sunday']",['KBS2'],80,7.9,1373,2069,2744,Not Yet Rated,"3,296","['Eugene', 'Lee Sang Woo', 'Go Doo Shim', 'Kim Mi Sook', 'Choi  Tae Joon', 'Oh Min Suk']","['KBS World', 'Viki']",7.4,9,"It looks like we don't have any Plot Summaries for this title yet. Be the first to contribute! Just click the ""Edit page"" button at the bottom of the page or learn more in the Plot Summary submission guide."
Jeong Do-jeon,"['action', 'thriller', 'historical', 'political']","['consort supporting character', 'historical fiction', 'revolution', 'biographical', 'corruption', 'goryeo dynasty', 'joseon dynasty', 'suspense ']",50,4-Jan-14,29-Jun-14,"['saturday', 'sunday']",['KBS1'],50,7.7,98,65641,7393,Not Yet Rated,731,"['Jo Jae Hyun', 'Yoo Dong Geun', 'Park Young Gyu', 'Seo In Seok', 'Im Ho', 'Ahn Jae Mo']",[],8.4,49,"Set between late Goryeo Dynasty and early Joseon Dynasty period. Jung Do-Jeon plans for the new country of ""Joseon"" and new culture as an influential advisor to King Taejo. Jung Do-Jeon resistance among those that want to keep Goryeo."
Chakhanmanyeojeon,"['comedy', 'romance', 'drama', 'melodrama']","['identity swap', 'double identity', 'identical twin female lead', 'flight attendant female lead', 'pilot male lead', 'innocent female lead', ""sisters' relationship"", 'brother-sister relationship', 'flashback to past', 'single mother ']",40,3-Mar-18,5-May-18,['saturday'],['SBS'],35,7.9,1982,2012,1791,15+ - Teens 15 or older,"5,406","['Lee Da Hae', 'Ryu Soo Young', 'Ahn Woo Yeon', 'Bae Soo Bin', 'Yoon Se Ah', 'Shim Hyung Tak']",['Viki'],7.4,100,"A housewife too nice for her own good is married to an unemployed husband. She switches places with her selfish, opinionated twin sister, who works as a flight attendant. Although they are identical twins, they have polar opposite personalities. Aboard the plane, she meets the pilot, an abstinent bachelor, and their journey sets off."
Babel,"['mystery', 'business', 'law', 'romance']","['revenge', 'infidelity', 'actress female lead', 'pregnant female lead', 'prosecutor male lead', 'flashback to past', 'attempted assault', 'wealth obsession', 'impulsive male lead', 'evil mother-in-law ']",16,27-Jan-19,24-Mar-19,"['saturday', 'sunday']","['TV Chosun', 'Viki']",60,7.4,676,4552,3092,18+ Restricted (violence & profanity),"2,819","['Park Shi Hoo', 'Jang Hee Jin', 'Kim Ji Hoon', 'Jang Shin Young', 'Kim Hae Sook', 'Kim Jong Goo']",['Viki'],6.6,54,"A prosecutor who started out as a newspaper reporter, whose personality is described as fiery and hot-tempered. He grew up in a comfortable life, but one day his family is shattered when his father dies in an accident whose cause is unclear, and his mother takes her own life. When he finds out that his father's bankruptcy and death are connected to a conglomerate, he begins his mission to uncover the truth and get revenge."
My Healing Love,"['romance', 'life', 'drama', 'family']","['calm female lead', 'calm male lead', 'nice male lead', 'slow burn romance', 'strong male lead', 'family relationship', 'cheating', ""childhood friends' relationship"", 'father-in-law - daughter-in-law relationship', 'part-time worker female lead ']",80,14-Oct-18,3-Mar-19,['sunday'],['MBC'],35,7.5,265,3769,5279,Not Yet Rated,"1,270","['So Yoo Jin', 'Yeon Jung Hoon', 'Yoon Jong Hoon', 'Ban Hyo Jung', 'Gil Yong Woo', 'Jung Ae Ri']",['Viki'],8.6,12,"A women is married with a younger man. Her life is hard, she's always had to take over her husband's problems. But suddenly she starts to meet a generous and success man who is always saving her from some troubles. He's divorced and has a little girl. One day, he realizes that they had already known each other long time ago but she doesn't remember anything

â€”selene_bs"
Sponsor,"['thriller', 'romance', 'drama']","['suspense', 'actress female lead', 'poverty', 'editor', 'hardworking male lead', 'hardworking female lead', 'greed', 'modeling', 'disease', 'photography ']",12,23-Feb-22,6-Apr-22,"['wednesday', 'thursday']","['MBN', 'Viki']",56,6.3,257,80573,3537,15+ - Teens 15 or older,"2,328","['Lee Ji Hoon', 'Han Chae Young', 'Ji Yi Soo', 'Koo Ja Sung', 'Kim Yun Seo', 'Park Geun Hyung']",['Viki'],5.4,21,"A romance thriller between four men and women running like a runaway locomotive toward different desires, including success, revenge, children and love."
Your House Helper,"['friendship', 'comedy', 'romance', 'life']","['housekeeper male lead', 'housekeeping', 'healing', 'life lesson', 'sismance', 'cold man/warm woman', 'slow burn romance', 'awkward male lead', 'internship', 'multiple mains ']",32,4-Jul-18,29-Aug-18,"['wednesday', 'thursday']",['KBS2'],30,7.9,3580,2088,1105,15+ - Teens 15 or older,"9,197","['Ha Seok Jin', 'Bona', 'Lee Ji Hoon', 'Go Won Hee', 'Seo Eun Ah', 'Jeon Soo Jin']",['Viki'],s 7,165,"The daily life of an average working woman involves: a packed subway during the rush hours, a miserable old boss, juniors clawing their way up, mounting credit card debt, and a rusty and tired body - And above all, the worst is the endless housekeeping work that awaits her at home. But what if a handsome guy appears and takes care of all the housekeeping work for her? And not only that, what if he solves the problems in her complicated and confused life? In this drama, a male house helper does housekeeping works in different women's houses and tries to solve their issues."
The Family Is Coming,"['comedy', 'romance', 'family']",[''],20,3-Jan-15,15-Mar-15,"['saturday', 'sunday']",['SBS'],60,7.1,505,5511,3624,15+ - Teens 15 or older,"2,247","['Jin Yi Han', 'Lee Jung Hyun', 'Oh  Sang Jin ', 'Park Won Sook', 'Cha Hak Yeon', 'Park So Jin']",['SBS World'],6.1,15,"It looks like we don't have any Plot Summaries for this title yet. Be the first to contribute! Just click the ""Edit page"" button at the bottom of the page or learn more in the Plot Summary submission guide."
Andante,"['comedy', 'romance', 'youth', 'melodrama']","['bittersweet ending', 'terminal illness', 'countryside setting', 'transfer student', 'coming of age', 'student', 'drama ']",16,24-Sep-17,7-Jan-18,['sunday'],['KBS1'],60,7.5,3008,3963,1074,15+ - Teens 15 or older,"9,513","['Kai', 'Lee Ye Hyun', 'Kim Jin Kyung', 'Baek Chul Min', 'Jeon Mi Seon', 'Sung Byung Sook']",['Viki'],6.7,224,Moving to a new school is easy for a computer genius who skips school. But things change.
Bad Papa,"['adventure', 'drama', 'family', 'sports']","['boxing', ""childhood friends' relationship"", 'morally ambiguous male lead', 'childhood crush', 'mad dog', 'car accident', 'impulsive male lead', 'benevolent father', 'secret crush', 'second chance romance ']",32,1-Oct-18,27-Nov-18,"['monday', 'tuesday']",['MBC'],35,7.7,860,3160,3034,13+ - Teens 13 or older,"2,883","['Jang Hyuk', 'Son Yeo Eun', 'Shin Eun Soo', 'Ha Joon', 'Kim Jae Kyung', 'David Lee']",['Viki'],7.3,124,"Yoo Ji Cheol used to be a top boxer. After hitting rock bottom, he decides to gain control of his life again through mixed martial arts."
Legal High,"['mystery', 'comedy', 'law', 'drama']","['eccentric male lead', 'strong female lead', 'sismance', 'law firm', 'satire', 'greed', 'mentor', 'slight romance', 'eccentric female lead', 'rivalry ']",16,8-Feb-19,30-Mar-19,"['friday', 'saturday']","['jTBC', 'Viki']",60,7.6,1238,3359,2439,15+ - Teens 15 or older,"3,807","['Jin Goo', 'Seo Eun Soo', 'Yoon Park', 'Chae Jung An', 'Jung Sang Hoon', 'Lee Soon Jae']",['Viki'],7.6,100,"A story of two completely different lawyers. Go Tae Rim is a lawyer with a 100 percent success rate who knows how to play with the law, and Seo Jae In is a rookie lawyer who believes in the law and justice."
Working Mom,"['romance', 'family']","['older woman/younger man', 'marriage ']",16,30-Jul-08,18-Sep-08,"['wednesday', 'thursday']",['SBS'],60,7.2,15,72473,99999,Not Yet Rated,170,"['Yeom Jung Ah', 'Bong Tae Kyu', 'Kim Ja Ok', 'Kwon Yool', 'Kim  Ka Yeon', 'Kim Ji Young']",[],6.9,9,"It looks like we don't have any Plot Summaries for this title yet. Be the first to contribute! Just click the ""Edit page"" button at the bottom of the page or learn more in the Plot Summary submission guide."
New Heart,"['romance', 'medical']","['hospital setting', 'surgeon female lead', 'surgeon male lead', 'doctor female lead', 'doctor male lead', 'heart surgery', 'older woman/younger man', 'nice male lead ']",23,12-Dec-07,28-Feb-08,"['wednesday', 'thursday']",['MBC'],60,7.7,657,2916,4177,15+ - Teens 15 or older,"1,804","['Kim Min Jung', 'Ji Sung', 'Jo Jae Hyun', 'Jung Ho Geun', 'Shin Da Eun', 'Son Yeo Eun']",['Viki'],8.1,65,"The pride and frustration of cardiac surgeons on the job. Lee Eun Sung graduated from a newly established medical school in the southern province and not from an elite one like the Hwang Hee University Hospital where he applied for residency with the hope of becoming a great cardiac specialist. Since he wasn't a graduate of Hwang Hee U., he was looked down upon by almost everyone at the hospital. Nam Hye Suk graduated with top marks and was regarded as a star student. She was an absolute fundamentalist and proud of herself. Dr. Choi Kang Gook became the new head of the Department of Thoracic and Cardiovascular Surgery after being in exile for 5 years for getting into trouble with his former superior. He was a genius but he was also a stubborn surgeon who does not care for hospital politics. It ended up only LES and NHS were the only doctors who applied for residency and they were accepted with great reluctance after being rejected outright by Dr. CKG. Lee Dong Gwon, a famous actor, was admitted to the Hospital for arrhythmia surgery. He knew NHS from elementary school and was infatuated with her. Between him and LES, who would NHS choose?

â€”DramaWiki"
"Take Care of Us, Captain","['romance', 'drama']","['airport setting', 'plane setting', 'pilot male lead', 'hidden past', 'love triangle ']",20,4-Jan-12,8-Mar-12,"['wednesday', 'thursday']",['SBS'],65,7,1280,5740,3019,13+ - Teens 13 or older,"2,901","['Gu Hye Seon', 'Yoo  Sun', 'Clara Lee', 'Lee Chun Hee', 'Ji Jin Hee', 'Kim Jin Sung']","['SBS World', 'Viki']",7.4,88,"Han Da Jin is an inspired pilot who tragically loses both of her parents after graduating from a prestigious pilot school in the US. She looses her faith in flying, but finds a reason to fly again to make her father proud. Kim Yoon Sung was Han Da Jin's fathers student and became a pilot under his studies, but after he tragically causes Han Da Jin's mother to die on the flight from Korea to San Francisco he loses faith in flying as well. Kim Yoon Sung finds his desire to fly again and turns out to be a successful captain. Han Da Jin and Kim Yoon Sung start to work together as captain and co-pilot, but Han Da Jin's way to become a successful captain is not guaranteed as Kim Yoon Sung wants to teach her the basics from the start. Also on the way of Han Da Jin's success is Kang Dong Soo, a flight tower manager who first brings the not pretty side in Han Da Jin.

â€”Anonymous"
Phoenix,"['romance', 'drama']","['riches to rags', 'love square', 'rich man/poor woman', 'first love', 'businessman', 'orphan male lead', 'soap opera', 'divorced couple', 'obsession ']",26,5-Apr-04,29-Jun-04,"['monday', 'tuesday']",['MBC'],60,7.3,437,5050,5735,13+ - Teens 13 or older,"1,117","['Lee Eun Joo', 'Lee Seo Jin', 'Eric Mun', 'Jung Hye Young', 'Kim Bin Woo', 'Lee Yoo Jin']",[],7.8,60,"A delightfully twisty inversion of the Cinderella story, Phoenix is about a woman who, by choosing to marry beneath her, falls from princess-status to peasant-status, and then rises again like the proverbial firebird. Lee Ji Eun defies her parents' wishes to marry poor student Jang Sae Hoon, but unable to handle the burdens of poverty, she later succumbs to her family's pressure and divorces him. Heartbroken, her husband leaves for the U.S., and the two don't see each other again until Sae Hoon returns to Korea as a wealthy, self-made businessman, and runs into her again, now a lowly domestic helper. Ji Eun, having experienced many humbling turns in life since he left, is struggling to keep herself and her family afloat, and finds that their roles have been reversed-but will Sae Hoon ever be able to forgive her? Can the ashes of their love turn back into a flame?"
Dae Jang-Geum Is Watching,"['food', 'comedy', 'romance', 'supernatural']","['entertainment industry', 'cooking', 'slow burn romance', 'boss-employee relationship', 'love triangle', 'bromance', 'youtuber male lead', 'workplace setting', 'retail clerk female lead', 'fraternal twin female lead ']",16,11-Oct-18,24-Jan-19,['thursday'],['MBC'],70,7.5,931,3751,2685,15+ - Teens 15 or older,"3,410","['Shin Dong Wook', 'Kwon Yu Ri', 'Lee Yeol Eum', 'Kim Hyun Joon', 'Lee Min Hyuk', 'Jung Yi Rang']",['Viki'],8.2,46,"This food-oriented drama imagines how the descendants of the famous Joseon woman doctor and alleged culinary genius Jang Geum (the subject of the famous sageuk Dae Jang Geum) might live today if they inherited some of her talents. San Hae has been gifted with an excellent sense of taste which has mad him a huge fan and connoisseur of food. His younger sister Jin Mi has been gifted with an exceptional sense of smell, and their younger brother Jung Shik has such excellent cooking skills he has his own Youtube vlog channel. The story follows San Hae at his work and his relationship with a rookie employee at his company, a woman named Bok Seung Ah.

â€”MyDramaList"
Dae Jang-Geum Is Watching,"['food', 'comedy', 'romance', 'supernatural']","['entertainment industry', 'cooking', 'slow burn romance', 'boss-employee relationship', 'love triangle', 'bromance', 'youtuber male lead', 'workplace setting', 'retail clerk female lead', 'fraternal twin female lead ']",16,11-Oct-18,24-Jan-19,['thursday'],['MBC'],70,7.5,931,3751,2685,15+ - Teens 15 or older,"3,410","['Shin Dong Wook', 'Kwon Yu Ri', 'Lee Yeol Eum', 'Kim Hyun Joon', 'Lee Min Hyuk', 'Jung Yi Rang']",['Viki'],8.2,46,"This food-oriented drama imagines how the descendants of the famous Joseon woman doctor and alleged culinary genius Jang Geum (the subject of the famous sageuk Dae Jang Geum) might live today if they inherited some of her talents. San Hae has been gifted with an excellent sense of taste which has mad him a huge fan and connoisseur of food. His younger sister Jin Mi has been gifted with an exceptional sense of smell, and their younger brother Jung Shik has such excellent cooking skills he has his own Youtube vlog channel. The story follows San Hae at his work and his relationship with a rookie employee at his company, a woman named Bok Seung Ah.

â€”MyDramaList"
Late Night Restaurant,"['food', 'life', 'drama']","['episodic format', 'life lesson', 'calm male lead', 'strong male lead', 'nice male lead ']",20,4-Jul-15,5-Sep-15,['saturday'],['SBS'],30,7.7,605,2678,3416,Not Yet Rated,"2,448","['Kim Seung Woo', 'Nam Tae Hyun', 'Jung Han Hun', 'Park Joon Myun', 'Son Hwa Ryung', 'Ban Min Jung']",[],7.8,90,"In a small restaurant, which is only open after midnight, a chef known as 'Master' (Kim Seung Woo) doesn't offer any menus, but is willing to whip up any dish his patrons desire. Every night, the mysterious Master dedicates himself to comforting the woes of his customers, including a gangster, a down-and-out actor, office ladies, a paper boy, and a night worker. Despite the restaurant's unconventional hours and rules, these denizens of the night still keep coming back for more."
One Well-Raised Daughter,"['business', 'romance', 'family', 'melodrama']","['family dispute', 'soap opera', 'family relationship', 'hidden identity', 'heiress', 'misunderstanding', 'strong female lead', 'marriage', 'cross-dressing', 'drama ']",122,2-Dec-13,30-May-14,"['monday', 'tuesday', 'wednesday', 'thursday', 'friday']",['SBS'],40,7.3,852,4880,2802,Not Yet Rated,"3,193","['Park Han Byul', 'Lee Tae Gon', 'Jung Eun Woo', 'Yoon  Se In', 'Kim Joo Young', 'Lee Hye Sook']",[],7.2,41,"To insure the inheritance of their family business, parents of four girls decide to raise their youngest daughter as a boy."
Bachelor's Vegetable Store,"['comedy', 'romance', 'drama', 'melodrama']","[""childhood friends' relationship"", 'rich woman/poor man', 'nice male lead', 'based on true story', 'friendship ']",24,21-Dec-11,8-Mar-12,"['wednesday', 'thursday']",['Channel A'],70,7,2025,5691,1682,13+ - Teens 13 or older,"5,864","['Ji Chang Wook', 'Wang Ji Hye', 'Kim Young Kwang', 'Park Soo Jin', 'Song Ji Hyuk', 'Sung Ha']",[],7.7,83,"Based on the true story of a young man who turned a tiny vegetable shop into a national chain, Bachelor's Vegetable Store centers on the love lives and successes of six single young men. Ji Chang Wook is a talented young man with big dreams who finds himself falling in love. Complications ensue when Chang Wook's friend, a wealthy heir who grew up without a father, comes to work at the shop and falls for a spoiled young heiress, who is drawn to Chang Wook instead. Pop singer Ji Hyuk, model Sung Ha, and musical actor Shin Won Ho round out the quartet of good-looking bachelors who work together and struggle with life, love, and their careers in this heartwarming, rags-to-riches story."
