imdb_name,Genres,Tags,Episodes,start airing,end airing,Aired On,Original Network,Duration,score,scored by,Ranked,Popularity,Content Rating,Watchers,actors,platforms,imdb_rating,imdb_user_count,imdb_description
Wild Romance,"['comedy', 'romance', 'sports']","['tomboy', 'ex-girlfriend comes back', 'stalker', 'baseball', 'sismance', 'bodyguard female lead', 'bipolar disorder', 'anti-fan', 'cyber bullying', 'enemies to lovers ']",16,4-Jan-12,23-Feb-12,"['wednesday', 'thursday']",['KBS2'],65,7.5,6197,4178,842,Not Yet Rated,"12,421","['Lee Dong Wook', 'Lee Si Young', 'Kang  Dong Ho', 'Oh Man Suk', 'Hwang Sun Hee', 'Im Ju Eun']",['Viki'],7.2,274,"Late at night in a Karaoke bar, Yoo Eun-Jae's father sees the Red Dreamers Baseball player Park Moo-Yeol, who he blames for ruining his beloved Blue Seagulls chance at the Championship, and gets into a confrontation. Yoo Eun-Jae, a bodyguard, defends her father using her Judo skills and throws Park Moo-Yeol to the ground. When the Red Dreamers find out a video of the incident has hit the Internet they decide that to prevent the negative publicity they will hire Yoo Eun-Jae to guard Park Moo-Yeol. This allows them to claim that the whole incident was merely practice and not the latest in a string of offences and embarrassments by Park Moo-Yeol. For the ploy to work under media attention however, Yoo Eun-Jae must actually perform as expected, in close attendance to Park Moo-Yeol. Thus the story plays out with Yoo Eun-Jae and Park Moo-Yeol battling not only each other, but a sinister stalker out to get the infamous Red Dreamer star Park Moo-Yeol.

â€”baby-luck"
Hush,"['mystery', 'business', 'comedy', 'life']","['journalism', 'corruption', 'investigation', 'injustice', 'hardworking male lead', 'hardworking female lead', 'adapted from a novel', 'teamwork', 'office worker', 'survival ']",16,11-Dec-20,6-Feb-21,"['friday', 'saturday']","['iQiyi', 'jTBC']",70,7.6,706,3658,3023,15+ - Teens 15 or older,"2,897","['Hwang Jung Min', 'Im Yoon Ah', 'Son Byung Ho', 'Yoo  Sun', 'Kim Won Hae', 'Park Ho San']",[],7.2,94,"A sympathetic and humane office drama based in a newspaper company, about the dilemma between the survival and conscience of reporters."
Missing 9,"['adventure', 'mystery', 'comedy', 'drama']","['plane crash', 'survival', 'strong female lead', 'lying', 'murder', 'nice male lead', 'disaster', 'slight romance', 'amnesia', 'melodrama ']",16,18-Jan-17,9-Mar-17,"['wednesday', 'thursday']",['MBC'],60,7.4,7016,4694,485,15+ - Teens 15 or older,"19,379","['Jung Kyung Ho', 'Baek Jin Hee', 'Choi  Tae Joon', 'Oh Jung Se', 'Lee Sun Bin', 'Park Chan Yeol']",[],6.9,389,"People from Legend Entertainment fly on a private plane to a concert. The 9 people consists of entertainers and staff members. The plane then becomes involved in a mysterious crash. The 9 people survive, but are stranded on a deserted island. 4 months later, Ra Bong-Hee returns to South Korea as the only survivor & witness from the plane crash."
My Fellow Citizens,"['comedy', 'romance', 'crime', 'political']","['character development', 'elections', 'social satire', 'hidden identity', 'strong female lead', 'lying', 'hardworking female lead', 'repentance', 'second chance', 'mad dog ']",36,1-Apr-19,28-May-19,"['monday', 'tuesday']",['KBS2'],35,7.7,3255,3021,1006,15+ - Teens 15 or older,"10,077","['Choi Si Won', 'Lee Yoo Young', 'Kim Min Jung', 'Tae In Ho', 'Kim Eui Sung', 'Heo Jae Ho']","['Viki', 'Netflix', 'Apple TV']",s 7,216,"Yang Jung Kook is a veteran conman, but he has never been arrested. One day, his girlfriend suddenly runs off with the money they were going to use for their marriage. Yang Jung Kook is extremely upset and he goes out to drink. He meets Kim Mi Young. She is going through a hard time herself because of her boyfriend's cheating ways. Yang Jung Kook tells her that he runs a business and Kim Mi Young tells him that she works for a small company. Kim Mi Young is actually a detective. They find comfort with each other and they develop a relationship romantically. On their wedding day, Kim Mi Young reveals to Yang Jung Kook that she is actually a detective. Meanwhile, Park Hoo Ja is a mysterious woman. She runs a private loan business that she inherited from her father. Her father was swindled by Yang Jung Kook. Park Hoo Ja finds Yang Jung Kook and blackmails him into running for a national assembly seat.

â€”AsianWiki"
The Good Wife,"['law', 'romance', 'drama', 'political']","['smart female lead', 'strong female lead', 'working mom', 'law firm', 'lgbtq+', 'infidelity', 'first love', 'love triangle', 'corruption', 'non-mdl remake ']",16,8-Jul-16,27-Aug-16,"['friday', 'saturday']",['tvN'],60,8.1,1831,1354,1613,15+ - Teens 15 or older,"6,224","['Jeon Do Yeon', 'Yoo Ji Tae', 'Yoon Kye Sang', 'Kim Seo Hyung', 'Lee Won Keun', 'Nana']",[],7.1,131,"A husband (Yoo Ji-Tae) works as a successful prosecutor and his future appears bright, but he gets arrested for corruption in a political scandal. His wife (Jeon Do-Yeon) worked as an attorney prior to their marriage, now resumes her career after a 13 year hiatus. She begins to find her true identity."
Let's Eat,"['food', 'comedy', 'romance', 'drama']","['strong female lead', 'nice male lead', 'smart female lead', 'smart male lead', 'older woman/younger man', 'divorce', 'korean food', 'enemies to friends', 'murder', 'bromance ']",16,28-Nov-13,13-Mar-14,['thursday'],['tvN'],54,7.9,7817,1695,571,15+ - Teens 15 or older,"17,366","['Lee Soo Kyung', 'Yoon Doo Joon', 'Yoon So Hee', 'Shim Hyung Tak', 'Lee Do Yeon', 'Feeldog']",['Netflix'],7.7,614,"Four single people: happily divorced paralegal Lee Soo-kyung (Lee Soo-kyung), mysterious gourmand Goo Dae-young (Yoon Doo-joon), design student and former rich girl Yoon Jin-yi (Yoon So-hee), and petty lawyer Kim Hak-moon (Shim Hyung-tak). Who enjoy living alone, except for that pesky problem that dining out is not designed for one. At Jin-yi's request, she, Soo-kyung and Dae-young start eating out together and thus get involved in each other's lives."
Rich Man,"['business', 'comedy', 'romance', 'melodrama']","['prosopagnosia', 'rich man/poor woman', 'eccentric male lead', 'prodigy', 'pathetic female lead', 'entrepreneur', 'weak female lead', 'slow burn romance', 'friendship ']",16,9-May-18,28-Jun-18,"['wednesday', 'thursday']","['DramaX', 'Viki']",65,7.4,9144,4745,466,15+ - Teens 15 or older,"20,046","['Suho', 'Ha Yeon Soo', 'Oh Chang Seok', 'Kim Ye Won', 'Choi Kwang Il', 'Park Sung Hoon']","['Apple TV', 'Hulu', 'Viki']",6.7,684,"Lee Yoo Chan is the CEO of IT company Next One. He founded the company and it is now the most desirable place to work for young professionals. He is arrogant and does not trust people in general. Lee Yoo Chan also suffers from an inability to recognize faces. Kim Bo Ra was born in the countryside on Jeju Island. She is the pride of her family and famous in her hometown for being smart. She goes to Seoul to attend college and carries her family's high expectations for her. During her last year in college, Kim Bo Ra experiences difficulties finding her job. Her dream is to work at Next One. Kim Bo Ra meets Lee Yoo Chan and their lives change."
The Greatest Love,"['business', 'comedy', 'romance']","['male chases female first', 'love triangle', 'impulsive male lead', 'eccentric male lead', 'scandal', 'hardworking female lead', 'character development', 'workplace abuse', 'misunderstanding', 'rich man/poor woman ']",16,4-May-11,23-Jun-11,"['wednesday', 'thursday']",['MBC'],65,8.1,14234,1230,299,Not Yet Rated,"27,498","['Cha Seung Won', 'Gong Hyo Jin', 'Yoo In Na', 'Yoon Kye Sang', 'Lee Hee Jin', 'Choi Hwa Jung']",['Viki'],7.8,"1,078","Gu Ae-Jeong, a wash out idol, meets famous actor Dokgo-Jin by chance. Off to a bad start, a series of rumors makes them get involved in each other's careers and boosts Ae-Jeong's popularity enough to participate in a match making show."
Sabotage City,"['thriller', 'mystery', 'psychological', 'drama']","['female centered plot', 'father-in-law - daughter-in-law relationship', 'news presenter male lead', 'foundation director female lead', 'mother-in-law - daughter-in-law relationship', 'married life', 'ambitious female lead', 'popular male lead', 'society', 'conglomerate ']",20,8-Dec-21,10-Feb-22,"['wednesday', 'thursday']",['jTBC'],70,7.2,334,5233,3559,15+ - Teens 15 or older,"2,306","['Park Soo Ae', 'Kim Kang Woo', 'Kim Mi Sook', 'Lee Yi Dam', 'Lee Hak Joo', 'Kim Young Jae']","['TVING', 'Viki', 'Netflix']",6.6,66,A psychological mystery thriller that tells the story of things which lose their meaning when greed and power comes into play.
The King's Face,"['action', 'thriller', 'historical', 'romance']","['physiognomy', 'gwanghae', 'nice male lead', 'joseon dynasty', 'suspense', 'cross-dressing', 'historical figure', 'historical fiction', 'strong female lead', 'political ']",23,19-Nov-14,5-Feb-15,"['wednesday', 'thursday']",['KBS2'],60,7.5,1343,4093,1795,15+ - Teens 15 or older,"5,394","['Seo In Guk', 'Lee Sung Jae', 'Jo Yoon Hee', 'Shin Sung Rok', 'Kim Gyu Ri', 'Im Ji Eun']",['Viki'],6.9,117,"Gwanghae (Seo In-guk), a son of a concubine, becomes the crown prince of Joseon . For the next 16 years, the illegitimate prince lives through conflicts, enduring death threats and dethronement attempts. Gwanghae's relationship with his father King Seonjo (Lee Sung-jae) was contentious. The two become rivals both in politics and love. Using physiognomy as a weapon and means to gain power, Gwanghae enlists a face-reading fortuneteller to help him become the next king.

â€”jaybeedormido"
Lie to Me,"['comedy', 'romance']","['pretend relationship', 'steamy kiss', 'heir', 'coming of age', 'hardworking female lead', 'ex-girlfriend comes back', 'lying', 'contract relationship', 'love/hate relationship', 'rich male lead ']",16,9-May-11,28-Jun-11,"['monday', 'tuesday']",['SBS'],64,7.5,20448,4207,208,15+ - Teens 15 or older,"35,279","['Yoon Eun Hye', 'Kang Ji Hwan', 'Sung Joon', 'Song Seo Yeon', 'Lee Kyung Jin', 'Won Jong Rye']","['Viki', 'Netflix']",7.1,"1,361","Jealous when her friend steals and marries her first love, a woman lies that she too is married. The lie ensnares a hotel president who goes along with the lie for his own reasons. Will the lie become reality?"
Summer Scent,"['romance', 'melodrama']","['heart transplant', 'accident', 'summer', 'florist', 'love square', 'second chance', 'love triangle ']",20,7-Jul-03,9-Sep-03,"['monday', 'tuesday']",['KBS2'],64,7.3,1517,5100,2531,Not Yet Rated,"3,635","['Song Seung Heon', 'Son Ye Jin', 'Ryu Jin', 'Han Ji Hye', 'Ha Jae Young', 'Shin Ae']",[],6.9,213,Three year's previously Min Woo lost his first love in a tragic accident. As he struggles on with life he meets Hae Won who reminds him of his lost love but is racked with emotion and confusion as his feelings for these two women become intertwined. Unbeknownst to the florist Hae Won she has received her heart transplant and a second chance at life from Min Woo's first love. When the two cross paths Hae Won notices her unusual heart beat. Nobody knew it was her heart that remembered and beats strong for her lost love Min Woo. As Hae Won starts falling in love with Min Woo soon the conflict erupts between the lovely florist and her fiancÃ© Jung Jae.
Children of Nobody,"['thriller', 'mystery', 'psychological', 'drama']","['trauma', 'child behavior issues', 'child abuse', 'smart female lead', 'murder', 'tragic past', 'psychiatry', 'child abandonment', 'domestic violence', 'strong female lead ']",32,21-Nov-18,16-Jan-19,"['wednesday', 'thursday']",['MBC'],30,8.6,4207,210,729,15+ - Teens 15 or older,"14,103","['Kim Sun Ah', 'Lee Yi Kyung', 'Nam Gyu Ri', 'Cha Hak Yeon', 'Joo Seok Tae', 'Na Young Hee']",['Viki'],7.8,241,"Cha Woo Kyung is a child counselor, happily married and pregnant. Her life gets turned around when she hits a child in a car accident. She works with detective, Kang Ji Hun, to catch a serial killer and uncover the mysteries of her past."
Shut Up Family,"['comedy', 'romance', 'sitcom']","['multiple couples', 'airhead female lead', 'smart female lead', 'mother-daughter relationship', 'male chases female first', 'tomboy', 'strong female lead', ""neighbors' relationship"", ""sisters' relationship"", 'brother-sister relationship ']",120,13-Aug-12,6-Feb-13,"['monday', 'tuesday', 'wednesday', 'thursday', 'friday']",['KBS2'],25,7.9,399,2008,4010,Not Yet Rated,"1,916","['Ahn Suk Hwan', 'Hwang Shin Hye', 'Park Ji Yoon', 'Park Hee Bon', 'Kim Da Som', 'Choi  Woo Shik']",[],8.4,27,"Shin-Hye is a divorcee who lives with her mother and 2 daughters. Suk-Hwan is a widower who lives with his mother-in-law and 3 kids. Shin-Hye and Suk-Hwan fall in love and marry. Now, the two families will have to learn to live together."
Trap,"['thriller', 'mystery', 'psychological', 'drama']","['investigation', 'suspense', 'action', 'detective fiction', 'dark fiction', 'unreliable narrator', 'speech disorder', 'police department', 'political power', 'workplace abuse ']",7,9-Feb-19,3-Mar-19,"['saturday', 'sunday']",['OCN'],70,7.8,1394,2213,2436,15+ - Teens 15 or older,"3,814","['Lee Seo Jin', 'Sung Dong Il', 'Im Hwa Young', 'Kim Kwang Gyu', 'Seo Young Hee', 'Yoon Gyung Ho']",[],7.2,135,"Kang Woo Hyun is a respected anchor at a broadcasting station. He has a lovely family and he is asked to enter the political field. His life seems perfect. One day, he goes on a trip with his family and a tragic situation occurs. Meanwhile, Go Dong Kook is a veteran detective. He takes Kang Woo Hyun's case and investigates."
"Jang Ok-jung, Living by Love","['historical', 'romance']","['king male lead', 'concubine', 'royalty ']",52,2-Jan-95,27-Jun-95,"['monday', 'tuesday']",N/A,60,10,2,99999,99999,Not Yet Rated,21,"['Yoo Dong Geun', 'Park Ji Young', 'Ban Hyo Jung', 'Kim Min Jung', 'Hyun Suk', 'Choi Sun Ah']",[],7.6,247,"Life Of Jang Ok-Jung, Later Known As Jang Hee-bin, one of the most famous Concubines of The Joseon Dynasty who was known for her hunger for power."
The Royal Gambler,"['action', 'historical', 'comedy', 'drama']","['historical fiction', 'royalty', 'gambling', 'family secret', 'joseon dynasty', 'bromance', 'family', 'friendship ']",24,28-Mar-16,14-Jun-16,"['monday', 'tuesday']",['SBS'],75,7.8,2439,2574,1368,15+ - Teens 15 or older,"7,449","['Jang Geun Suk', 'Yeo Jin Goo', 'Jeon Kwang Ryul', 'Choi Min Soo', 'Im Ji Yeon', 'Yoon Jin Seo']","['Viki', 'Netflix', 'SBS World']",7.6,246,Dae-Gil and King Yeongjo enter a match. Dae-Gil bets his life and King Yeongjo bets the entire Kingdom of Joseon on the outcome.
Goodbye Mr. Black,"['thriller', 'business', 'romance', 'drama']","['wrongfully accused', 'betrayal', 'adapted from a manhwa', 'revenge', 'double identity', 'rich male lead', 'suspense ']",20,16-Mar-16,19-May-16,"['wednesday', 'thursday']",['MBC'],65,7.5,3200,4109,1072,15+ - Teens 15 or older,"9,527","['Lee Jin Wook', 'Moon Chae Won', 'Yoo In Young', 'Kim Kang Woo', 'Song Jae Rim', 'Kim Tae Woo']","['iWant TFC', 'Viki']",7.1,210,"When a skilled Navy SEAL demolitions officer is framed as a traitor, he uses a fake marriage to assume a new identity and seek revenge."
Beautiful World,"['thriller', 'mystery', 'life', 'melodrama']","['school bullying', 'coma', 'tearjerker', 'student', 'psychopath', 'high school', 'investigation', 'suspense', 'strong female lead', 'violence ']",16,5-Apr-19,25-May-19,"['friday', 'saturday']","['jTBC', 'Viki']",60,8.5,2761,281,1152,15+ - Teens 15 or older,"8,849","['Park Hee Soon ', 'Choo Ja Hyun', 'Oh Man Suk', 'Cho Yeo Jung', 'Nam  Da Reum ', 'Kim Hwan Hee']","['Disney+ Hotstar', 'Viki']",8.2,141,"""Beautiful World,"" tells of an incident of school violence which leaves a young boy on the precipice of life and death as his family seeks for justice in his stead."
Room No. 9,"['mystery', 'drama', 'fantasy']","['body swap', 'prison', 'hardworking female lead', 'badass female lead', 'wrongfully accused', 'smart female lead', 'deception', 'smart male lead', 'older woman/younger man', 'calm male lead ']",16,6-Oct-18,25-Nov-18,"['saturday', 'sunday']",['tvN'],65,7.8,1224,2548,1734,15+ - Teens 15 or older,"5,603","['Kim Hee Sun', 'Kim Hae Sook', 'Kim Young Kwang', 'Lee Kyung Young', 'Oh Dae Hwan', 'One']",['K-DRAMA'],7.7,90,"Eulji Hae Yi (Kim Hee Sun, Ice Fantasy) is a lawyer at a prestigious firm. She cares only about her career. She constantly butters up the people who can help her succeed and completely disregards the poor. She is willing to do anything to win cases and has enjoyed a quick rise to the top at her firm. Ki Yoo Jin (Kim Young Kwang, Lookout) is Eulji Hae Yi's boyfriend. A doctor by profession, Ki Yoo Jin seems like a true gentleman to anyone who meets him. In Eulji Hae Yi's eyes, he is the perfect accessory to match her perfect resume in life. But behind his handsome face and demeanor hides something dark. Jang Hwa Sa (Kim Hae Sook, Saimdang: Light's Diary) is a death row inmate. She became a household name when her infamous ""poison murder case"" became a hit with the sensationalist media. She has been on death row for 33 years, with no chance of getting out. When Eulji Hae Yi visits the strange visitation room 9, where Jang Hwa Sa is waiting for her, something happens. Eulji Hae Yi switches bodies with the inmate. Now the lawyer must figure out how to save her client as if her own life depends on it. Because, for once, it actually does. Also known as ""Room Nine,"" Room No. 9 is directed by Ji Yeong Su and written by Jung Sung Hee. It aired in 2018."
The Greatest Divorce,"['comedy', 'romance', 'drama']","['personal assistant supporting character', 'cheerful female lead', 'grandma-grandson relationship', 'failing marriage', 'married couple', 'infidelity', 'divorce', 'eccentric male lead', 'multiple couples', 'family ']",32,8-Oct-18,27-Nov-18,"['monday', 'tuesday']",['KBS2'],35,7.9,1069,1962,2456,15+ - Teens 15 or older,"3,789","['Cha Tae Hyun', 'Bae Doo Na', 'Lee El', 'Son Seok Koo', 'Wi Ha Joon', 'Moon Sook']",['Viki'],7.5,68,"Jo Seok-Moo (Cha Tae-Hyun) graduated from a prestigious university, but he pursued his dream of becoming a musician rather than finding a traditional job. Jo Seok-Moo unfortunately did not become a musician and because of his advanced age, he could not land a decent job. He finds a job at a security service company where he met Kang Whee-Roo (Bae Doo-Na) for the first time as his customer. They eventually get married and have been for 3 years now, however suddenly Jo Seok-Moo asks for a divorce. When taking a closer look they do not have very much in common. Jo Seok-Moo has a stubborn personality and enjoys spending time alone, while Kang Whee-Roo is easy-going and has a positive personality. Meanwhile, a married couple of Jin Yoo-Young (Lee El) and Lee Jang-Hyun (Son Suk-Ku) appear. Which comes to a surprise because Jin Yoo-Young is Jo Seok-Moo's first love."
The Suspicious Housekeeper,"['mystery', 'drama', 'family', 'melodrama']","['housekeeper', 'smart female lead', 'calm female lead', 'badass female lead', 'detective supporting character', 'talented female lead', 'talented male lead', 'dark fiction', 'death', 'character development ']",20,23-Sep-13,26-Nov-13,"['monday', 'tuesday']",['SBS'],65,7.7,3534,2957,1192,15+ - Teens 15 or older,"8,570","['Choi Ji Woo', 'Lee Sung Jae', 'Kim So Hyun', 'Wang Ji Hye', 'Chae Sang Woo', 'Nam  Da Reum ']","['SBS World', 'Viki']",7.5,157,"A drama about a housekeeper Park Bok Nyeo, who gets hired to work for a family which has just lost its mother, leaving just the father and 4 children. But, she's strange. She is unsociable housekeeper who is perfect in what she does around the house but doesn't smile or show her feelings due to her mysterious past. Bok Nyeo will help the family healing process and rebuild their bonds.

â€”DramaWiki"
Please Don't Date Him,"['comedy', 'romance', 'drama', 'sci-fi']","['artificial intelligence', 'nice male lead', 'programmer', 'smart female lead', 'bad/wrong tag', 'obsessive ex-lover', 'clingy ex-boyfriend', 'sismance', 'break off engagement', 'hidden camera crime ']",10,10-Nov-20,12-Jan-21,['tuesday'],"['MBC', 'MBC every1']",60,7.8,3620,2612,967,15+ - Teens 15 or older,"10,518","['Song  Ha Yoon', 'Lee Jun Young', 'Yoon Bo Mi', 'Gong Min Jung', 'Joo Woo Jae', 'Nam Min Woo']","['Viki', 'WeTV', 'Apple TV']",6.9,176,"An AI programmer accidentally develops an AI program called Cho Sang Shin, which will identify trashy humans, and she uses it to save people who are in difficult relationships."
My Daughter Seo Young,"['comedy', 'romance', 'family', 'melodrama']","['brother-sister relationship', 'father-daughter relationship', 'rich man/poor woman', 'warm man/cold woman', 'soap opera', 'heir', 'cold man/warm woman', 'love triangle', 'drama ']",50,15-Sep-12,3-Mar-13,"['saturday', 'sunday']",['KBS2'],65,7.9,1788,1685,2071,15+ - Teens 15 or older,"4,616","['Chun Ho Jin', 'Lee Bo Young', 'Lee Sang Yoon', 'Park Hae Jin', 'Choi Yoon Young', 'Choi Jung Woo']","['KBS World', 'Viki']",s 8,95,"The story of a father who separates with his daughter, their love, hate and reconciliation. Seo Young is a tough woman who tries to escape the harsh life of poverty with a strong passion to gain success, overcome her lower status and rise in society. On the road to fulfill her dream, she cuts ties with her poor family and incompetent father who still loves his daughter despite her bitterness."
My Fair Lady,"['romance', 'drama']","['materialistic female lead', 'bad/wrong tag ']",16,13-Aug-03,2-Oct-03,"['wednesday', 'thursday']",['SBS'],45,7,220,75487,6385,Not Yet Rated,942,"['Go Soo', 'Kim Hee Sun', 'Son Chang Min', 'Park Han Byul', 'Lee Soon Jae', 'Kwon Hae Hyo']",[],6.9,536,"My Fair Lady"" centers around Hye-na Kang (Yoon Eun-Hye), an heiress to the Kang-san Group and owner of the palace known as ""Lady Castle."" She lives with her servants as her parents died in a plane accident and her grandfather raised her as a child. Then on day, a young scamp named Dong-chan (Yun Sang-Hyeon) becomes a butler at ""Lady Castle"" in an attempt to gain Hye-na's money and heart. Things become even more complicated as rich lawyer Tae-yun (Jeong Il-Woo) steps in-between them ."
Oh! My Lady,"['comedy', 'drama', 'family', 'melodrama']","['father-daughter relationship', 'swindler male lead', 'child female lead', 'innocent female lead', 'disabled female lead', 'selfish male lead', 'kind female lead', 'terminal care', 'sick female lead', 'selfless female lead ']",16,16-Nov-16,11-Jan-17,"['wednesday', 'thursday']",['KBS2'],60,8.2,1816,831,1858,15+ - Teens 15 or older,"5,214","['Heo Jung Eun', 'Oh Ji Ho', 'Park Jin Hee', 'Oh Yoon Ah', 'Park Min Su', 'Kang Ji Woo']",[],6.9,226,"Series Outline: Sung Min Woo is the top male star in Korea due to his good looks and singing talent. Ambitious, he moved into TV dramas which he helps with his star power and hinders with his terrible acting. He also has an exploitative, unethical manager. Yoon Gae Hwa is a housewife divorced from a rich husband who needs to earn enough money to keep her daughter in her custody while her ex-husband's new wife doesn't want the daughter of a previous wife around. Gae Hwa's sole prior work experience is 6 months as a reporter for a weekly scandal rag. Her first jobs shown in the series are unsuccessful but include 1 day as housekeeper for Sung Min Woo where a babysitting emergency forces her to leave early, infuriating Sung Min Woo. Shortly afterwards, she finds another job at a musical production company, learns a secret about Sung Min Woo, and convinces him to work on the agency's musical, and becomes Min Woo's handler for that agency as it prepares to put on a musical starring Min Woo (if he ever improves as an actor). Handling Min Woo is no easy task due to their mutual antagonism, spurred by Min Woo's immaturity. Min Woo grows up as he faces the challenges of caring for his unexpected 5-year-old daughter Ye Eun, the result of an affair several years earlier, and by Gae Hwa's example in caring for the otherwise unprotected Ye Eun. Min Woo gains maturity very quickly as he learns to accept and love his daughter and becomes something unexpected - a good actor. The romance also ends satisfyingly - but I'm not telling that part of the ending.

â€”dgdg"
Spring Must Be Coming,"['business', 'comedy', 'drama', 'fantasy']","['body swap', 'sismance', 'sassy female lead', 'smart female lead', 'strong female lead', 'eccentric female lead', 'naive female lead', 'infidelity', 'revenge', 'bromance ']",32,23-Jan-19,21-Mar-19,"['thursday', 'wednesday']",['MBC'],35,7.9,1173,1676,2555,15+ - Teens 15 or older,"3,602","['Lee Yoo Ri', 'Uhm Ji Won', 'Choi Byung Mo', 'Lee Jong Hyuk', 'Ahn Se Ha', 'Kim Nam Hee']","['Apple TV', 'Viki']",7.8,57,"Kim Bo Mi works as a TV news anchorwoman and she only cares about herself. Lee Bom was once a popular actress, but she is now a lawmaker's wife. She focuses only on taking care of her family. Somehow these two women switch bodies."
Player,"['action', 'thriller', 'mystery', 'comedy']","['strong female lead', 'corruption', 'hidden identity', 'conspiracy', 'double identity', 'fight', 'gang', 'unusual friendship', 'badass male lead', 'hardworking male lead ']",14,29-Sep-18,11-Nov-18,"['saturday', 'sunday']",['OCN'],65,8.4,5519,518,614,Not Yet Rated,"16,409","['Song Seung Heon', 'Krystal Jung', 'Lee Si Eon', 'Tae Won Seok', 'Kim Won Hae', 'Ahn Se Ho']","['Viki', 'WeTV', 'K-DRAMA']",7.8,332,"A crime proceeds redemption team consists of a smart swindler, a fighter, a hacker and a driver. The crime proceeds redemption team attempts to take back property hidden away by criminals. Kang Ha-Ri and Cha A-Ryeong are members of the crime proceeds redemption team. Cha A-Ryeong was abandoned by her parents when she was little and she is skilled at driving.

â€”fahadabe"
